{
  "$schema": "http://json-schema.org/draft-04/schema#",
  "id": "https://raw.githubusercontent.com/gruke-build/src/master/source/Nuke.CodeGeneration/schema.json",
  "title": "Tool specification schema file by NUKE",
  "definitions": {
    "DataClass": {
      "type": "object",
      "properties": {
        "name": {
          "description": "Name of the data class.",
          "type": "string",
          "pattern": "^[0-9A-Z][A-Za-z0-9]*$"
        },
        "baseClass": {
          "description": "The base class to inherit from.",
          "type": "string"
        },
        "extensionMethods": {
          "description": "Enables generation of extension methods for modification.",
          "type": "boolean"
        },
        "omitDataClass": {
          "description": "Omits generation of the data class.",
          "type": "boolean"
        },
        "properties": {
          "description": "Properties of the data class.",
          "type": "array",
          "items": {
            "$ref": "#/definitions/Property"
          }
        },
        "deprecationMessage": {
          "description": "Obsolete message. DataClass is marked as obsolete when specified.",
          "type": "string"
        },
        "deprecationUrl": {
          "description": "Obsolete URL. Tool is marked as obsolete when specified.",
          "type": "string",
          "format": "uri"
        }
      },
      "required": [
        "name"
      ]
    },
    "Enumeration": {
      "type": "object",
      "properties": {
        "name": {
          "description": "Name of the enumeration.",
          "type": "string",
          "pattern": "^[0-9A-Z][A-Za-z0-9]*$"
        },
        "values": {
          "description": "The enumeration values.",
          "type": "array",
          "items": {
            "type": "string"
          }
        },
        "deprecationMessage": {
          "description": "Obsolete message. Enumeration is marked as obsolete when specified.",
          "type": "string"
        },
        "deprecationUrl": {
          "description": "Obsolete URL. Tool is marked as obsolete when specified.",
          "type": "string",
          "format": "uri"
        }
      },
      "required": [
        "name",
        "values"
      ]
    },
    "Property": {
      "type": "object",
      "properties": {
        "name": {
          "description": "Name of the property.",
          "type": "string",
          "pattern": "^[0-9A-Z][A-Za-z0-9]*$"
        },
        "type": {
          "description": "Type of the property. I.e., bool, int, string, List<int>, Dictionary<string, object>, Lookup<string, int.>",
          "type": "string"
        },
        "json": {
          "description": "Name used when serializing to JSON.",
          "type": "string"
        },
        "format": {
          "description": "Argument formatting for the property. '{value}' is replaced by the value of the property.",
          "type": "string"
        },
        "itemFormat": {
          "description": "Item formatting for dictionaries. '{key}' and '{value}' are replaced accordingly.",
          "type": "string"
        },
        "hidesBase": {
          "description": "Minimize compilation warnings by including a 'new' keyword on this definition.",
          "type": "boolean"
        },
        "oneWayFlag": {
          "description": "Specifies if this property is for a boolean flag with no value. This will only generate a single extension, instead of the usual 3 (Disable, Enable, Toggle).",
          "type": "boolean"
        },
        "customBoolExtensionPrefix": {
          "description": "Specify a custom string to be used in place of 'Enable/Disable' prefixing the generated extension (boolean property only). Expected to be used in tandem with oneWayFlag.",
          "type": "string",
          "pattern": "^[0-9A-Z][A-Za-z0-9]*$"
        },
        "noArgument": {
          "description": "Omits argument parsing.",
          "type": "boolean"
        },
        "customImpl": {
          "description": "Custom implementation of the property.",
          "type": "boolean"
        },
        "separator": {
          "description": "Separator used for items of collection types.",
          "type": "string"
        },
        "disallowedCharacter": {
          "description": "Character that must be double-quoted.",
          "type": "string"
        },
        "quoteMultiple": {
          "description": "Specifies if list items should be double quoted.",
          "type": "boolean"
        },
        "default": {
          "description": "Default value that will be used if no value is given.",
          "type": "string"
        },
        "secret": {
          "description": "Specifies that the value is secret and should be hidden in output.",
          "type": "boolean"
        },
        "customValue": {
          "description": "Custom implementation of value presentation.",
          "type": "boolean"
        },
        "createOverload": {
          "description": "Specifies that an overload for the property should be created.",
          "type": "boolean"
        },
        "help": {
          "description": "Help text for the property.",
          "type": "string"
        },
        "delegates": {
          "description": "Dictionary delegates for named properties.",
          "type": "array",
          "items": {
            "$ref": "#/definitions/Property"
          }
        },
        "deprecationMessage": {
          "description": "Obsolete message. Property is marked as obsolete when specified.",
          "type": "string"
        },
        "deprecationUrl": {
          "description": "Obsolete URL. Tool is marked as obsolete when specified.",
          "type": "string",
          "format": "uri"
        },
        "onlyDelegates": {
          "type": "boolean"
        },
        "isTailArgument": {
          "type": "boolean"
        }
      },
      "required": [
        "name",
        "type"
      ]
    },
    "SettingsClass": {
      "description": "The settings of the task.",
      "type": "object",
      "properties": {
        "name": {
          "description": "Name of the data class.",
          "type": [
            "string",
            "null"
          ],
          "pattern": "^[0-9A-Z][A-Za-z0-9]*$"
        },
        "baseClass": {
          "description": "The base class to inherit from.",
          "type": "string"
        },
        "extensionMethods": {
          "description": "Enables generation of extension methods for modification.",
          "type": "boolean"
        },
        "omitDataClass": {
          "description": "Omits generation of the data class.",
          "type": "boolean"
        },
        "properties": {
          "description": "Properties of the data class.",
          "type": "array",
          "items": {
            "$ref": "#/definitions/Property"
          }
        },
        "deprecationMessage": {
          "description": "Obsolete message. DataClass is marked as obsolete when specified.",
          "type": "string"
        },
        "deprecationUrl": {
          "description": "Obsolete URL. Tool is marked as obsolete when specified.",
          "type": "string",
          "format": "uri"
        }
      }
    },
    "Task": {
      "type": "object",
      "properties": {
        "help": {
          "description": "Help or introduction text to for the tool. Supports 'a-href', 'c', 'em', 'b', 'ul', 'li' and 'para' tags for better formatting.",
          "type": "string"
        },
        "postfix": {
          "description": "Postfix for the task alias.",
          "type": "string",
          "pattern": "^[0-9A-Z][A-Za-z0-9]*$"
        },
        "returnType": {
          "description": "Return type of the task.",
          "type": "string"
        },
        "omitCommonProperties": {
          "description": "Skips appending of common task properties.",
          "type": "boolean"
        },
        "commonPropertySets": {
          "description": "Appends the properties of the named property sets.",
          "type": "array",
          "items": {
            "type": "string"
          }
        },
        "preProcess": {
          "description": "Generates a pre-process hook",
          "type": "boolean"
        },
        "postProcess": {
          "description": "Generates a post-process hook",
          "type": "boolean"
        },
        "logLevelParsing": {
          "description": "Enables log level parsing",
          "type": "boolean"
        },
        "customStart": {
          "description": "Custom start implementation.",
          "type": "boolean"
        },
        "customAssertion": {
          "description": "Custom process assertion implementation.",
          "type": "boolean"
        },
        "definiteArgument": {
          "description": "Argument that will always be printed independently of any set property.",
          "type": "string"
        },
        "officialUrl": {
          "description": "Url of the task. If not specified, the tool url will be used.",
          "type": "string"
        },
        "settingsClass": {
          "$ref": "#/definitions/SettingsClass"
        },
        "deprecationMessage": {
          "description": "Obsolete message. Task is marked as obsolete when specified.",
          "type": "string"
        },
        "deprecationUrl": {
          "description": "Obsolete URL. Tool is marked as obsolete when specified.",
          "type": "string",
          "format": "uri"
        }
      }
    }
  },
  "type": "object",
  "properties": {
    "$schema": {
      "type": "string"
    },
    "references": {
      "description": "Contains all references on which this definition is based on. Allows checking for updates.",
      "type": "array",
      "items": {
        "type": "string"
      }
    },
    "imports": {
      "type": "array",
      "items": {
        "type": "string"
      }
    },
    "name": {
      "description": "Name of the Tool.",
      "type": "string",
      "pattern": "^[0-9A-Z][A-Za-z0-9]*$"
    },
    "officialUrl": {
      "description": "Url to the official website.",
      "type": "string",
      "format": "uri"
    },
    "preferTypedApi": {
      "description": "Marks the generic task (ArgumentStringHandler as its first parameter) as deprecated, signaling to callers to prefer the typed API instead for the specified reason.",
      "type": "string"
    },
    "deprecationMessage": {
      "description": "Obsolete message. Tool is marked as obsolete when specified.",
      "type": "string"
    },
    "deprecationUrl": {
      "description": "Obsolete URL. Tool is marked as obsolete when specified.",
      "type": "string",
      "format": "uri"
    },
    "help": {
      "description": "Help or introduction text to for the tool. Supports 'a-href', 'c', 'em', 'b', 'ul', 'li' and 'para' tags for better formatting.",
      "type": "string"
    },
    "nugetPackageId": {
      "description": "ID for the NuGet package.",
      "type": "string"
    },
    "npmPackageId": {
      "description": "ID for the NPM package.",
      "type": "string"
    },
    "aptgetPackageId": {
      "description": "ID for the AptGet package.",
      "type": "string"
    },
    "packageExecutable": {
      "description": "Exact name of the main executable found in the './tools' folder. Case-sensitive.",
      "type": "string"
    },
    "pathExecutable": {
      "description": "Exact name of the executable that can be found via 'where' or 'which'.",
      "type": "string"
    },
    "customExecutable": {
      "description": "Defines that locating the executable is implemented customly.",
      "type": "boolean"
    },
    "customLogger": {
      "description": "Enables custom logger.",
      "type": "boolean"
    },
    "tasks": {
      "description": "Help or introduction text to for the tool. Can contain HTML tags for better formatting.",
      "type": "array",
      "items": {
        "$ref": "#/definitions/Task"
      }
    },
    "commonTaskProperties": {
      "description": "Common properties for all tasks.",
      "type": "array",
      "items": {
        "$ref": "#/definitions/Property"
      }
    },
    "commonTaskPropertySets": {
      "description": "Named common property sets which can be used by tasks.",
      "type": "object",
      "additionalProperties": {
        "type": "array",
        "items": {
          "$ref": "#/definitions/Property"
        }
      }
    },
    "dataClasses": {
      "description": "Common used data classes.",
      "type": "array",
      "items": {
        "$ref": "#/definitions/DataClass"
      }
    },
    "enumerations": {
      "description": "Used enumerations.",
      "type": "array",
      "items": {
        "$ref": "#/definitions/Enumeration"
      }
    },
    "_metadata": {
      "description": "Can be used to store additional information about the tool.",
      "type": "object",
      "additionalProperties": {
        "type": [
          "string",
          "number",
          "integer",
          "boolean",
          "object",
          "array"
        ]
      }
    }
  },
  "required": [
    "name",
    "officialUrl"
  ]
}
