{
  "$schema": "https://raw.githubusercontent.com/gruke-build/src/master/source/Nuke.Tooling.Generator/schema.json",
  "references": [
    "https://raw.githubusercontent.com/erichexter/WebConfigTransformRunner/master/Readme.md"
  ],
  "name": "WebConfigTransformRunner",
  "officialUrl": "https://github.com/erichexter/WebConfigTransformRunner",
  "help": "This is a commandline tool to run an ASP.NET web.config transformation.",
  "nugetPackageId": "WebConfigTransformRunner",
  "packageExecutable": "WebConfigTransformRunner.exe",
  "tasks": [
    {
      "settingsClass": {
        "properties": [
          {
            "name": "WebConfigFilename",
            "type": "string",
            "format": "{value}",
            "position": 1,
            "help": "The base web.config file"
          },
          {
            "name": "TransformFilename",
            "type": "string",
            "format": "{value}",
            "position": 2,
            "help": "The transformation web.config file"
          },
          {
            "name": "OutputFilename",
            "type": "string",
            "format": "{value}",
            "position": 3,
            "help": "The path to the output web.config file"
          }
        ]
      }
    }
  ]
}
